,,,,MA-MUSEOS_AR-OSM-0296,CABA,CABA,Q20639610,es:Museo del Libro y de la Lengua,File:Museo del Libro y la Lengua 40.JPG,way/261439793,,,,-34.5851599,-58.399405,Museo del libro y de la lengua,Avenida  Las Heras 2555,C1425EID,,+54 11 4808 0090,museodellibro@bn.gov.ar,https://www.bn.gov.ar/biblioteca/museo,,,2011,"El Museo del libro y de la lengua, que abrió sus puertas en 2011, está pensado como un recorrido por la cultura nacional, por la experiencia de nuestra condición de hablantes y lectores. ",,,,
,,,,MA-MUSEOS_AR-OSM-0297,CABA,CABA,Q65486199,,,node/3641685691,,,,-34.571818,-58.4401168,Museo Profesor Miguel Ángel Fernández,Avenida Cabildo 381,C1426AAD,,+54 11 4576-5576,museo@ign.gob.ar,,,,,,,,,
,,,,MA-MUSEOS_AR-OSM-0298,CABA,CABA,Q65486205,,,node/4619155089,,,,-34.6394412,-58.3636511,Museo Conventillo 'Marjan Grum',Avenida General José Garibaldi 1429,C1167ACC,,,,,,,,,,,,
,,,,MA-MUSEOS_AR-OSM-0299,CABA,CABA,Q16609930,es:Museo de Informática de la República Argentina,File:Museo de informática (frente).JPG,node/6160235679,,,,-34.5964433,-58.3774819,Museo de Informática,Avenida Marcelo T. de Alvear 740,,,+54 011 4312-6845,,,,Privado,,"Es el primer Museo de Informática de nuestro país y la exhibición de equipos informáticos históricos favorece la enseñanza a través de objetos reales y operativos, brindando una oportunidad única al público en general, estudiantes y profesionales.",,,,
,,,,MA-MUSEOS_AR-OSM-0300,CABA,CABA,Q65486229,,,node/5981929851,,,,-34.6065664,-58.3900664,Museo del Audífono,Avenida Teniente General Juan Domingo Perón 1647,C1037ACD,,+54 11 4382-9068,jorgebek@yahoo.com.ar,http://www.museodelaudifono.com.ar/,,Privado,,"Su colección cuenta con más de 500 piezas, con aparatología diversa en su conjunto, hallando audífonos del siglo pasado, -a carbón, a válvula, solar, de caja, etc.- incluyendo asimismo modelos actuales.",,,,
,,,,MA-MUSEOS_AR-OSM-0301,CABA,,,,,,,,,,,Museo de meteorología y oceanografía “El tiempo en el tiempo” (UBA),Avenida Intendente Güiraldes 2160,C1428EGA,,54 11 4576.3300 INT. 283,extension@.at.fcen.uba.ar,,,,,"Museo que repasa la historia de la meteorología y oceanografía desde su comienzo hasta la actualidad. Exhibe una línea del tiempo, cartas meteorológicas, imágenes satelitales, maquetas e instrumentos meteorológicos, los cuales están a disposición de alumnos y docentes de la especialidad y para los visitantes.",,,,
,,,,MA-MUSEOS_AR-OSM-0302,CABA,,,,,,,,,,,Museo de Maquinarias Agrícolas,,,,,,https://www.agro.uba.ar/catedras/maquinaria_agricola/museo,,,,,,,,
300020,10,10021020,,MA-MUSEOS_AR-OSM-0303,Catamarca,Andalgala,,,,,,,,-27.575748,-66.32354,Museo Mineralógico Y Folklórico Municipal,San Martín y Schmidt,4740,,,,,,Municipal,,"Colección variada de minerales y vestimenta de gaucho, instrumentos musicales, herramientas de labranza y utensilios de la vida cotidiana.",,,,
300021,10,10021020,,MA-MUSEOS_AR-OSM-0304,Catamarca,Andalgala,,,,,,,,-27.58347,-66.315951,Museo Arqueológico Provincial Samuel Alejandro Lafone Quevedo,Pérez de Zurita 640,K4740BKL,03835,4422381,,,,Provincial,1968,"Arqueología del período agro-alfarero: temprano, medio y tardío (1200-1800 D.C.). Materiales Condor Huasi, Ciénaga, Aguada, Shiquimil, San José, Halfin, Belén, Santa María, Sanagasta, Andalgalá, Inca, Yocavi, Famabalasto, Caspischango y Colonial.",1968,,,
300022,10,10021020,,MA-MUSEOS_AR-OSM-0305,Catamarca,Andalgalá,,,,,,,,-27.575748,-66.32354,Museo Mineralógico Municipal Francisco Vera,Pérez de Zurita s/n Ciudad de Andalgalá.,4740,,,,,,Municipal,,Colección variada de minerales del departamento.,,,,
300023,10,10021020,,MA-MUSEOS_AR-OSM-0306,Catamarca,Andalgalá,,,,,,,,-27.575748,-66.32354,Museo De Sitio Muschaka. Complejo Turístico Minero,Choya Andalgalá,4740,,,,,,Municipal,,"Muschaka fue un complejo minero que desarrolló una intensa actividad entre los años 1902 y 1914, siendo sede de una empresa multinacional (Cooper Company),  que fundía mineral de cobre extraído de los Cerros de Minas Capillitas. En este sitio se pueden a",,,,
300025,10,10028010,,MA-MUSEOS_AR-OSM-0307,Catamarca,Antofagasta de la Sierra,,,,,,,,-29.319132,-65.056913,Museo Mineralógico De La Puna,Avenida  San Martín S/n,4705,,,,,,Privada,,"Minerales del departamento de Antofagasta de la Sierra -de salares, volcanes y canteras de mármol- y del resto de la provincia de Catamarca y del país; posee ocho vitrinas donde se albergan los cristales más delicados y las muestras más pequeñas, también",,,,
300026,10,10028010,,MA-MUSEOS_AR-OSM-0308,Catamarca,Antofagasta de la Sierra,,,,,Museo Nacional,DNM,No,-26.036968,-67.438246,Museo Del Hombre,Plaza 9 de Julio,4705,,,,,propios,Municipal,2001,"Colecciones arqueológicas provenientes de investigaciones sistemáticas realizadas en el área y de donaciones de pobladores, objetos históricos donados por pobladores.",,,,
300058,10,10035020,,MA-MUSEOS_AR-OSM-0309,Catamarca,Belén,,,,,,,,-27.646092,-67.035558,Museo Arqueológico Provincial Cóndor Huasi,"San Martín 310. Galería Misael, Planta Alta",K4750BXH,,,,,,Provincial,1948,El museo cuenta con una colección de mas de 3000 objetos arqueológicos procedentes de distintas localidades del departamento Belén representativos del proceso cultural desde el período Pre-cerámico hasta el Incaico y Colonial. Posee finos objetos confecc,1948,,,
300316,10,10035040,,MA-MUSEOS_AR-OSM-0310,Catamarca,Corral Quemado,,,,,,,,-27.152562,-66.950398,Museo Integral De Corral Quemado,Corral Quemado,4751,,,,,,Municipal,,El Museo Integral de Corral Quemado exhibe importantes piezas arqueológicas y objetos históricos de la vida cotidiana donadas por los lugareños.,,,,
300364,10,10105110,,MA-MUSEOS_AR-OSM-0311,Catamarca,Fiambalá,,,,,,,,-27.681686,-67.643215,Museo De Los Seismiles,Centro Cívico-cultural,5345,03837,496250,,,,Municipal,,"En su sala se exhiben elementos utilizados en expediciones de alta montaña -vestimenta, documentos, fotografías, herramientas, croquis. Se completa la muestra con imágenes e información de las altas cumbres del territorio Catamarqueño, que superan los 6.",,,,
300365,10,10105110,,MA-MUSEOS_AR-OSM-0312,Catamarca,Fiambalá,,,,,,,,-27.681686,-67.643215,Museo De Sitio De La Comandancia De Armas,Barrio San Pedro,5345,03837,4496016,,,,Municipal,,"Se ubica sobre la Ruta del Adobe, circuito histórico cultural de 55 km. que comienza en Tinogasta y termina en la localidad de Fiambalá. Alberga los elementos encontrados durante los trabajos de restauración y limpieza de la Comandancia de Armas, edifici",,,,
300366,10,10105110,,MA-MUSEOS_AR-OSM-0313,Catamarca,Fiambalá,,,,,,,,-27.691054,-67.620898,Museo Del Hombre,Abaucan S/n,5345,03837,4496250,direcciondeculturayeducacion@tinogasta.com.ar,,,Municipal,1997,"Colecciones antropológicas y arqueológicas de las culturas Cienaga, Aguada, Belén, Sanagasta, Santamarianas, desde el año 500 AC al 1300 DC.",1997,,,
300410,10,10035070,,MA-MUSEOS_AR-OSM-0314,Catamarca,Hualfin,,,,,,,,-27.211913,-66.835488,Museo Arqueológico De Hualfin,Calle Principal,4751,03835,4473001,,,,Municipal,,"Funciona en una sala construida en el año 2000, dentro del predio de la iglesia Nuestra Señora del Rosario de Hualfin (1770), Monumento Histórico Nacional. Las piezas que se exhiben corresponden a distintas expresiones de la cultura material, asociadas a",,,,
300444,10,10077040,,MA-MUSEOS_AR-OSM-0315,Catamarca,La Higuera,,,,,,,,-31.015767,-65.100709,Estancia Jesuítica La Candelaria,La Candelaria - departamento Cruz del Eje,X5285AEB,0351,4333425,,,,Provincial,,"Museo de sitio declarado Patrimonio Histórico de la Humanidad desde el año 2000. Objetos religiosos, arte sacro y un valioso conjunto arquitectónico del siglo XVIII.",,,,
300445,10,10077040,,MA-MUSEOS_AR-OSM-0316,Catamarca,La Higuera,,,,,,,,-31.015767,-65.100709,Museo Popular De Historia Regional Macat Henen,Calle Pública S/n,X5285AEB,,,,,,,2011,"La exposición está organizada en colecciones temáticas: alimentos de origen Americano; caracoles, entomofauna y fauna; cuadros; fotos; pueblos originarios; rincón de la escritura; rincón de la fe; rincón de los tejidos; rincón del campo; rincón del hogar",2011,,,
300579,10,10084060,,MA-MUSEOS_AR-OSM-0317,Catamarca,Mutquin,,,,,,,,-28.3262,-66.156735,Museo Arqueológico E Histótirico Municipal De Mutquin,Pje. Bicentenario S/n,5317,0383,154619465,,,,Municipal,,"Se trata de un pequeño museo con dos salas en las que se dispone la muestra principal, una sala de muestras transitorias, y dependencias administrativas y de depósito. Cuenta, hasta la fecha, con unos 500 bienes, los cuales se hallan completamente invent",,,,
300627,10,10035140,,MA-MUSEOS_AR-OSM-0318,Catamarca,Puerta de San José,,,,,,,,-27.542267,-67.015311,Museo De Puerta De San José,Puerta de San José,4751,,,,,,Municipal,,En instalaciones de la Municipalidad de Puerta de San José se exhiben un Gliptodonte y restos arqueológicos de la localidad.,,,,
300769,10,10049030,,MA-MUSEOS_AR-OSM-0319,Catamarca,San Fernando del Valle de Catamarca,,,,,,,,-28.447415,-65.756226,Museo Provincial De La Fiesta Nacional E Internacional Del Poncho,Avenida  México s/n - Predio Ferial Catamarca,4700,0383,4437564,,,,Provincial,,"Museo referido a la historia de la Fiesta Nacional e Internacional del Poncho. La exhibición remite a los diversos aspectos que dieron cuerpo a esta fiesta a partir del año 1967: artesanías, artistas, reinas, escenarios, imaginería gráfica. Se trata de l",,,,
300770,10,10049030,,MA-MUSEOS_AR-OSM-0320,Catamarca,San Fernando del Valle de Catamarca,,,,,,,,-28.4664,-65.78,Museo Arqueológico Adán Quiroga,Sarmiento 450,4700,0383,4437413,,,,Mixta: Orden Franciscana y Municipalidad de San Fernando del Valle de Catamarca.,,"Objetos de las culturas Precolombinas del Noroeste Argentino, desde el período Pre-cerámico hasta el Período Inca; objetos históricos y folclóricos.",,,,
300771,10,10049030,,MA-MUSEOS_AR-OSM-0321,Catamarca,San Fernando del Valle de Catamarca,,,,,,,,-28.467,-65.7792,Museo Esquiú,"Convento de San Francisco, Esquiú 554",4700,,,acevedosilvina@cedeconet.com.ar,,,Mixta: Orden Franciscana y Municipalidad de San Fernando del Valle de Catamarca.,,"Se exhiben objetos personales de Fray Mamerto Esquiú -orador de la Constitución Nacional-, como gasulla, solideo, vestimenta, mobiliario, entre otras cosas.",,,,
300772,10,10049030,,MA-MUSEOS_AR-OSM-0322,Catamarca,San Fernando del Valle de Catamarca,,,,,,,,-28.467328,-65.829192,Centro De Interpretación Del Pueblo Perdido,Ruta Prov. 4 Km 4,4700,,,,,,Municipal,,El Centro de Interpretación del sitio arqueológico Pueblo Perdido de la Quebrada exhibe panelería interpretativa y los hallazgos resultantes de las excavaciones de este yacimiento  representativo de la cultura Aguada con dataciones del siglo V a X de la,,,,
300773,10,10049030,,MA-MUSEOS_AR-OSM-0323,Catamarca,San Fernando del Valle de Catamarca,,,,,,,,-28.4741,-65.7783,Casa Caravatti. Museo de la Ciudad,Rivadavia 1050,4700,,,turismoycultura@sfvcatamarca.gov.ar - cultura@sfvcatamarca.gov.ar,www.sfvcatamarca.gov.ar,,Municipal,,"Este nuevo museo exhibirá en su planta baja el patrimonio histórico y religioso de la ciudad y en la planta alta un museo de arte contemporáneo, albergando la actual pinacoteca municipal. Cuenta con salas de exhibición para muestras temporales, salas con",,,,
300774,10,10049030,,MA-MUSEOS_AR-OSM-0324,Catamarca,San Fernando del Valle de Catamarca,,,,,,,,-28.4698,-65.7825,Museo Provincial De Bellas Artes Laureano Brizuela,San Martín 316,4700,0383,4437563,museobellasartescat@yahoo.com.ar,,,Provincial,,"Esculturas, pinturas, grabados y dibujos, acuarelas y fotografías, de autores nacionales y latinoamerianos. Biblioteca sobre arte.",1939,,,
300775,10,10049030,,MA-MUSEOS_AR-OSM-0325,Catamarca,San Fernando del Valle de Catamarca,,,,,,,,-28.469563,-65.789319,Museo Folklórico Provincial Juan Alfonso Carrizo,"Paseo General Navarro, Subsuelo (la Alameda)",4700,0383,4459896,,,,Provincial,1975,"Reproducción del hábitat del hombre folk y sus artesanías: alfarería, cestería, imaginería, instrumentos musicales, trabajos en cuero, utensilios del hogar, elementos de labranza, tejidos y un telar rústico a pala. Único museo de la provincia que posee p",1980,,,
300776,10,10049030,,MA-MUSEOS_AR-OSM-0326,Catamarca,San Fernando del Valle de Catamarca,,,,,,,,-28.471,-65.7809,Museo Histórico De La Provincia,Chacabuco 425,4700,0383,4437562,patrisaseta@hotmail.com,,,Provincial,1954,"Objetos relacionados con las personas y hechos destacados de la historia provincial. Documentos, bastones, medallística; galería de gobernadores; mobiliario del antiguo Congreso Nacional y de la Legislatura provincial; objetos personales de Dr. Alfonso C",1977,,,
300884,10,10091150,,MA-MUSEOS_AR-OSM-0327,Catamarca,Santa María,,,,,,,,-26.662254,-66.058905,Museo Arqueológico Provincial Eric Boman,"San Martín, Esq. Belgrano, Centro Cultural",4139,03838,4421083,,,,Provincial,,"A través de las numerosas piezas resguardadas se puede tener una visión del pasado, recorriendo los diferentes períodos, el alfarero temprano, el medio, el tardío, hasta llegar al contacto Hispano Indígena, destacándose las piezas de cerámica de las cult",,,,
300929,10,10105180,,MA-MUSEOS_AR-OSM-0328,Catamarca,Tinogasta,,,,,,,,-28.060524,-67.568221,Museo Arqueológico Dr. Guillermo Rafael Alanís,Copiapó 488,K5340AMJ,0387,154471469,,,,Privada,,"Colección arqueológica Precolombina: cerámica, objetos de metal y piedra, vasijas, estatuillas, adornos, hachas, puntas de flecha, parideros de piedra, conanas, pertenecientes a diferentes culturas del departamento de Tinogasta.",,,,
300930,10,10105180,,MA-MUSEOS_AR-OSM-0329,Catamarca,Tinogasta,,,,,,,,-28.066266,-67.580239,Museo Arqueológico De Tinogasta Tulio Robaudi,"Constitución 750, Centro Cultural",K5340AKR,,,,,,Municipal,,"El museo fue creado a partir de una colección arqueológica privada, donada a la municipalidad de Tinogasta en 1983, conformada por manifestaciones de quienes habitaron el territorio. Elementos de diferentes materiales y con distintas utilidades son expue",,,,
300952,10,10035020,,MA-MUSEOS_AR-OSM-0330,Catamarca,Ubicado a 5 Km. de la ciudad de Londres,,,,,,,,-27.707704,-67.147962,Museo Y Centro De Interpretación Del Sitio El Shincal,"Sitio Arqueológico ""el Shincal""",4751,03835,4491019,,,,Municipal,,El museo nació a partir de las investigaciones realizadas por el Dr. Rodolfo Raffino y luego del proceso de puesta en valor y restauración del sitio arqueológico. En él funcionaba un centro administrativo y militar construido y administrado por el Imperi,,,,
301033,10,10035150,,MA-MUSEOS_AR-OSM-0331,Catamarca,Villa Vil,,,,,,,,-27.098075,-66.828946,Museo Comunitario De Barranca Larga,Ruta Prov. 43,4741,,,,,,,,"El museo comunitario de Barranca Larga es un edificio de adobe con dos salas de exposición, torreon de avistaje, galería y patios. Las exhibiciones son consensuadas por los miembros de la comunidad mediante talleres; el museo es también sede de la radio",,,,
301034,10,10035150,,MA-MUSEOS_AR-OSM-0332,Catamarca,Villa Vil,,,,,,,,-27.073616,-66.830753,Museo Integral de la Reserva de Biosfera de Laguna Blanca,Reserva de La Biosfera de Laguna Blanca,4741,03835,4452001,inip_unca@yahoo.com.ar,https://www.facebook.com/MuseoIntegralLB/,,Nacional,,"Se ubica en la reserva de la biosfera de Laguna Blanca, al norte del departamento de Belén. Este museo excede los límites del edificio y su recorrido implica introducirse en el extenso territorio coincidente con las dimensiones de esta maravillosa reserv",,,,
300055,22,22140010,,MA-MUSEOS_AR-OSM-0333,Chaco,Barranqueras,,,,,,,,-27.487334,-58.931266,Museo Del Centenario Casita De Barranqueras,Avenida  Laprida 5355,H3503HSH,,,,,,Provincial,,El museo cuenta la historia de la EGB N° 30 y de Barranqueras.,,,,
300115,22,22028010,,MA-MUSEOS_AR-OSM-0334,Chaco,Charata,,,,,,,,-27.22258,-61.191561,Museo Regional Municipal Del Sudoeste Chaqueño,Avda. Gral. San Martín 263,H3730AQC,0731,421533,,,,Municipal,1988,"Museo histórico, de ciencias naturales, paleontológico y arqueológico. Se exhiben restos fósiles de la era Terciaria y Cuaternaria, cerámica pre y post colombina, elementos líticos y réplicas en yeso de la evolución del hombre; en el área histórica se de",1986,,,
300268,22,22126020,,MA-MUSEOS_AR-OSM-0335,Chaco,Colonia Benítez,,,,,,,,-27.333117,-58.94503,"Museo, Casa Y Jardín Botánico Augusto Schulz",Avenida  Schulz 150,3505,,,,,,Provincial y Municipal,,"El museo fue la vivienda del Dr. Augusto G. Schulz, reconocido botánico chaqueño. Se conserva tal como la dejó a su fallecimiento, con mobiliario original, taller y jardín, con una importante cantidad de especies nativas de Argentina y de otros países, l",,,,
300424,22,22014020,,MA-MUSEOS_AR-OSM-0336,Chaco,Isla del Cerrito,,,,,,,,-27.295318,-58.617865,Museo Histórico Regional De La Isla Del Cerrito,Casco Histórico - Isla del Cerrito,3518,0362,496296,,,,Provincial y Municipal,,"Preserva y difunde la historia regional de la provincia y del país. Recorre el desarrollo de la guerra de la Triple Alianza (1865-1870) y el proceso de instalación del Hospital Aberastury (1939-1974), que dejó en el casco histórico sólidas construcciones",,,,
300484,22,22112020,,MA-MUSEOS_AR-OSM-0337,Chaco,La Tigra,,,,,,,,-27.118326,-60.589884,Museo Regional La Tigra - Herramientas Que Hicieron Chaco,Planta Urbana,3701,03722,494057,,,,Privada,1909,"Creado a principios de la década de 1990, con el propósito de reflejar el trabajo de la gente de La Tigra. Arados, sembradoras y herramientas utilizadas en los obrajes chaqueños.",,,,
300492,22,22056030,,MA-MUSEOS_AR-OSM-0338,Chaco,Lapachito,,,,,,,,-27.161324,-59.390409,Museo Hortencio Quijano,Villa Quijano (2 Km de Planta Urbana),3514,,,,,,Municipal,,"Casa, estación de tren y administración de las empresa que forjó Hortensio Quijano, ex vicepresidente de la Argentina, junto a Juan D. Perón.",,,,
300493,22,22105010,,MA-MUSEOS_AR-OSM-0339,Chaco,Las Breñas,,,,,,,,-27.085899,-61.087719,Museo Municipal Del Inmigrante,Vedia y Rivadavia,3722,0364,462340,,,,Municipal,,"Pinacoteca de la Esc. Nac 374, y objetos de la historia de la localidad y sus pobladores",,,,
300501,22,22014040,,MA-MUSEOS_AR-OSM-0340,Chaco,Las Palmas,,,,,,,,-27.050434,-58.6796,Museo Y Archivo Histórico Ricardo Y Carlos Hardy,Inmueble de Las Ex Instalaciones de La Empresa Las Palmas del Chaco Austral S.A.,3518,03722,452738,,,,Provincial,,"El museo está ubicado en el inmueble conocido como Casa Grande, donde funcionaron las oficinas de personal del complejo azucarero las palmas. Se exhiben muebles y elementos que pertenecieron al ingenio, a la familia Hardy, y otros que documentan la histo",,,,
300539,22,22126030,,MA-MUSEOS_AR-OSM-0341,Chaco,Margarita Belén,,,,,,,,-27.264177,-58.974166,Museo Del Cooperativismo Juan Pellizardi,Planta Urbana,3505,03722,452738,,,,Provincial,,"El museo rinde homenaje al espíritu solidario que unió a los agricultores organizados en la cooperativa agrícola algodonera ""El Triunfo"", institución que inicialmente fue una modesta cooperativa familiar, para consolidarse con el paso de los años y trans",,,,
300620,22,22084070,,MA-MUSEOS_AR-OSM-0342,Chaco,Presidencia Roca,,,,,,,,-26.142754,-59.596855,Museo Municipal Benjamín Victorica,Avenida Capitán Solari y  Victorica,3511,,,,,,Municipal,,"Exhibe armas, estribos, cabalgaduras, registro fotográfico y documentos del regimiento 12 de caballería de línea, cuya misión fue mantener los 13 fortines ubicados a lo largo del Río Bermejo.",,,,
300621,22,22021010,,MA-MUSEOS_AR-OSM-0343,Chaco,Presidencia Roque Sáenz Peña,,,,,,,,-26.786811,-60.430133,Museo De Los Paisanos Checoslovacos Jan Osycka,,3700,,,,,,Privada,,"Exhibe banderas, discos, bordados, uno de los trajes tradicionales fue donado por el Alcalde de Velké Bílovice, también un tocadiscos que llegó a Argentina en 1904,  trajes Checos, etc.",,,,
300622,22,22021010,,MA-MUSEOS_AR-OSM-0344,Chaco,Presidencia Roque Sáenz Peña,,,,,,,,-26.794967,-60.438517,Museo Histórico De La Fundación,Avenida  1 Entre 4 y 6,3700,0364,4431550,,,,Municipal,,Exhibe trajes que pertenecieron al regimiento 6° de caballería y almacén de ramos generales.,,,,
300623,22,22021010,,MA-MUSEOS_AR-OSM-0345,Chaco,Presidencia Roque Sáenz Peña,,,,,,,,-26.794146,-60.442137,Museo Histórico De La Ciudad,Avenida  Sarmiento y Pasaje Centenario,3700,,,,,,Mixta,,"El museo funciona en el edificio de la primera estación de trenes del antiguo Ferrocarril Central Norte, el cual fue reconstruido con reminiscencias coloniales. su acervo está compuesto por alfarería indígena, piezas del ferrocarril y colecciones de elem",,,,
300641,22,22077040,,MA-MUSEOS_AR-OSM-0346,Chaco,Puerto Tirol,,,,,,,,-27.380678,-59.085751,Museo Del Tanino,,3505,0362,4492129,,,,Municipal,,"El patrimonio del museo está formado por donaciones de antiguas familias: fotografías familiares, de paisajes, de situaciones cotidianas, utensilios, monedas de la época de ""quebrachales fusionados"", escudos, entre otros.",,,,
300647,22,22133010,,MA-MUSEOS_AR-OSM-0347,Chaco,Quitilipi,,,,,,,,-26.875748,-60.218521,Museo Aborigen René James Sotelo,"Avenida Antártida Argentina, Esq.  Sarmiento",3530,03722,480462,,,,Privado,,"Museo dedicado a las artesanías aborígenes. Se destacan bastones de mando de los Caciques; piezas de los Tobas, Matacos y Mocovíes; tallas en madera de algarrobo y palosanto; tapices matacos; máscaras de barro. también posee arcos y flechas de los distin",,,,
300670,22,22140060,,MA-MUSEOS_AR-OSM-0348,Chaco,Resistencia,,,,,,,,-27.424954,-59.012563,"Sitio Histórico, Casa Y Museo Luis Geraldi",Santa Fe 3100 . Villa Elba,3500,0362,4468577,,,,Provincial,,"Funciona en la vivienda más antigua que hoy existe en Chaco e ilustra la vida desarrollada por los primeros inmigrantes. su acervo está compuesto por una variada colección de objetos -vestimenta, mobiliario, maquinaria, enseres-, archivos gráficos y foto",,,,
300671,22,22140060,,MA-MUSEOS_AR-OSM-0349,Chaco,Resistencia,,,,,,,,-27.439341,-58.981387,Museo De Las Esculturas Urbanas Del Mundo (Museum),Avenida  de Los Inmigrantes 1001,3500,0362,4415020,,,,Privada,,"Exhibe obras realizadas en los sucesivos concursos realizados durante la Bienal de Esculturas. Dispone de sala de restauración y mantenimiento de las más de 500 esculturas instaladas en las calles de la ciudad, que son parte del recorrido a cielo abierto",,,,
300672,22,22140060,,MA-MUSEOS_AR-OSM-0350,Chaco,Resistencia,,,,,,,,-27.449875,-58.98572,Museo De La Memoria,Marcelo T. de Alvear 32,H3500ACB,0362,4453223,,,,Provincial,,"Espacio que apunta a mantener viva la memoria, transmitir, explicar e investigar los hechos ocurridos en el país durante la última dictadura militar. Realiza muestras referidas a la temática y a los derechos humanos. El museo está ubicado en el edificio",,,,
300673,22,22140060,,MA-MUSEOS_AR-OSM-0351,Chaco,Resistencia,,,,,,,,-27.451012,-58.982826,Museo De Medios De Comunicación  Raúl Berneri,Carlos Pellegrini 213,H3500CDE,0362,4453145,,,,Provincial,,"Fue creado con la intención de preservar y fomentar la conciencia histórica del Chaco en aspectos relacionados a los medios de comunicación. Funciona en el edificio que perteneció al diario ""El Territorio"" y su acervo da testimonio del proceso de fabrica",,,,
300674,22,22140060,,MA-MUSEOS_AR-OSM-0352,Chaco,Resistencia,,,,,,,,-27.4523,-58.9818,Fogón De Los Arrieros,Brown 350,H3500AFH,0362,4426418,elfogondelosarrieros@hotmail.com,,,Privada,,"El fogón surgió como iniciativa de Aldo Boglietti, como un estilo de vida, hasta adquirir forma en el año 1943 y transformarse en punto de encuentro de artistas e intelectuales, y taller de pintores y escultores. En él se pueden apreciar murales de Urruc",,,,
300675,22,22140060,,MA-MUSEOS_AR-OSM-0353,Chaco,Resistencia,,,,,,,,-27.453889,-58.993107,Museo Del Títere Tibi,Vedia 547,H3500BMK,0362,4421054,,,,Privada,,"Colección de alrededor de 700 títeres, entre marionetas, títeres de guantes, varillas, manoplas, dediles y otros. Se exhiben títeres clásicos de diversas partes del mundo -Grecia, Italia, Francia, Alemania, República Checa, EE.UU., Brasil, México, Perú-,",,,,
300676,22,22140060,,MA-MUSEOS_AR-OSM-0354,Chaco,Resistencia,,,,,,,,-27.465443,-58.968602,Museo - Espacio Resistencia,Hipólito Irigoyen 1875,3500,0362,4439315,,,,Privada,,"Alberga la colección ""Arte para la ciudad"", compuesta por obras de artistas pioneros de la plástica local, como Carlos Schenone, Rafael Galindez, Alfredo Pertile y Mauro Glorioso. De la plástica nacional y latinoamericana se exhiben obras de Carlos Colom",,,,
300677,22,22140060,,MA-MUSEOS_AR-OSM-0355,Chaco,Resistencia,,,,,,,,-27.468072,-59.005289,Museo Malvinas del Chaco,Avenida  Alberdi 2100,H3506KLZ,,+54 362 4446570,museomalvinaschaco@hotmail.com.ar,http://museomalvinaschaco.net,,Privada,,"El Museo Histórico-Conmemorativo perteneciente a la Asociación Veteranos de Guerra “2 DE ABRIL” de la provincia de Chaco funciona desde el año 2013, fue pensado y creado por ex soldados combatientes de las Islas Malvinas. Propone un recorrido por la geografía, la flora, la fauna y la historia política del archipiélago poniendo énfasis en el conflicto armado de 1982 a través del acervo y de testimonios de los protagonistas. Tiene como misión mantener vigente la ""Causa Malvinas"" ofreciendo a la comunidad experiencias significativas que promuevan la reflexión sobre la temática.",,lu.-vie. de 8 a 12 hs.,,
