300409,38,38094020,,MA-MUSEOS_AR-OSM-0584,Jujuy,Huacalera,,,,,,,,-23.433613,-65.353734,Museo Arqueológico E Histórico De Huacalera,"Avenida Calle Lavalle, Esq.  20 de Junio",Y4626XAI,0388,4955204,,,,Municipal,2004,"Colección perteneciente al sitio arqueológico La Huerta, declarado Monumento Histórico Nacional en el año 2000. Vasijas, huesos y material lítico, producto de las investigaciones realizadas por el Dr. Jorge Palma.",,,,
300411,38,38094040,Código en Maimará,MA-MUSEOS_AR-OSM-0585,Jujuy,Huichaira,,,,,,,,-23.610592,-65.408916,Museo En Los Cerros,Quebrada de Huichaira S/n,Y4624XAH,011,59142134,,,,,,,,,,
300415,38,38028040,,MA-MUSEOS_AR-OSM-0586,Jujuy,Humahuaca,,,,,,,,-23.204655,-65.349799,Museo Arqueológico Dr. Justiniano Torres Aparicio,Córdoba 115,Y4630BNC,0388,4228993,,,,Privada,,"Colección de piezas de la zona de Inca Cueva, madera, tejidos, cestería, cuero, material lítico y momias.",,,,
300416,38,38028040,,MA-MUSEOS_AR-OSM-0587,Jujuy,Humahuaca,,,,,,,,-23.206936,-65.348366,Museo Del Patrimonio Intangible,Buenos Aires 433,Y4630BCI,0388,154173549,,,,Privada,,Su objetivo es conservar y exponer un conjunto de elementos que abarcan las manifestaciones materiales de todas las ramas del Folklore. Pertenencias de los campesinos del lugar; instrumentos musicales del noroeste; materiales y elaboración de comidas y b,,,,
300417,38,38028040,,MA-MUSEOS_AR-OSM-0588,Jujuy,Humahuaca,,,,,,,,-23.205505,-65.352316,Museo Arqueológico Municipal,Santa Fe s/n Barrio Centro,Y4630BCP,03887,421375,,,,Municipal,,"Colecciones provenientes de yacimientos arqueológicos prehistóricos, cultura Anaguaco.",,,,
300418,38,38028040,,MA-MUSEOS_AR-OSM-0589,Jujuy,Humahuaca,,,,,,,,-23.202589,-65.346917,Museo Francisco Ramoneda,Salta 214,Y4630DNF,03887,421066,,,,Privada,,"Dibujos y pinturas del artista Francisco Ramoneda (1905-1977), de su primera etapa, desarrollada en Buenos Aires, y de la etapa posterior, inspirada en los paisajes, la gente y las costumbres festivas y religiosas de la Quebrada de Humahuaca y de todo el",1940,,,
300419,38,38028040,,MA-MUSEOS_AR-OSM-0590,Jujuy,Humahuaca,,,,,,,,-23.864688,-65.472178,Museo  De Esculturas Nicasio Fernández Mar,Buenos Aires S/n,Y4630BCP,03887,421375,,,,Municipal,1988,"Esculturas y bocetos del artista Nicasio Fernández Mar. Fotografías, anotaciones, proyectos.",1988,,,
300477,38,38112050,,MA-MUSEOS_AR-OSM-0591,Jujuy,La Quiaca,,,,,,,,-22.103537,-65.597741,Museo Comunitario Puna,Árabe Siria y 25 de Mayo,Y4650CMB,03885,423039,,,,Municipal,,"Piezas arqueológicos de la Cultura Yavi/Chicha, Arcaico e Inka.",,,,
300478,38,38112050,,MA-MUSEOS_AR-OSM-0592,Jujuy,La Quiaca,,,,,,,,-22.108933,-65.595921,Museo Arqueológico Y Etnográfico Musoj Ñan,Sarmiento 60,Y4650CYN,0388,423423,,,,Privada,,Piezas arqueológicas de épocas tempranas y tardías de la Cultura Yavi/Chicha. Piezas paleontológicas.,,,,
300511,38,38035080,,MA-MUSEOS_AR-OSM-0593,Jujuy,Libertador General San Martin,,,,,,,,-32.075717,-60.463175,Museo David Rhys,25 de Mayo 99,E3103XAF,0343,4918000,geociencia@uapar.edu,,,Privada,1909,"Mineralogía -rocas y minerales de diversas regiones del país-, paleontología -restos de animales y plantas fósiles de la zona y del extranjero-, botánica -restos de plantas de la región- y zoología -restos de aves, anfibios, reptiles y mamíferos de la re",1909,,,
300512,38,38035080,,MA-MUSEOS_AR-OSM-0594,Jujuy,Libertador Gral. San Martín,,,,,,,,-23.831745,-64.789536,Centro De Visitantes Ledesma,"Reconquista 442, Barrio Ledesma",Y4512GCB,03886,429439,,,,Privada,,"Sitio interactivo en donde el visitantes puede responder a sus interrogantes sobre la producción en la empresa o participar de procesos industriales esquemáticos. En el patio de exposiciones se presentan máquinas de agro y piezas de maquinaria fabril, pa",2008,,,
300841,38,38063180,,MA-MUSEOS_AR-OSM-0595,Jujuy,San Pedro,,,,,,,,-24.235257,-64.865667,"Museo Histórico, Arqueológico Y De Arte Pablo Baldwin",Miguel F. Aráoz Esq. 9 de Julio,Y4500EZJ,03888,15446466,,,,,,Museo único en la región que alberga la historia del Pueblo de San Pedro.,,,,
300842,38,38063180,,MA-MUSEOS_AR-OSM-0596,Jujuy,San Pedro,,,,,,,,-33.675601,-59.6616,Museo Histórico Regional Fray José María Bottaro,9 de Julio 134,B2930HZD,03329,427677,musehistoricosanpedro@yahoo.com.ar,,,Privada,1982,Colecciones y documentos referidos a la historia del lugar.,1982,,,
300843,38,38063180,,MA-MUSEOS_AR-OSM-0597,Jujuy,San Pedro,,,,,,,,-26.622337,-54.114682,Museo Cacique Bonifacio Maidana,Avenida  25 de Mayo y San Martín,3352,03751,470222,,,,Municipal,1987,"Arqueología: restos del Paleolítico y del Neolítico, hallados en la zona. Artesanía Guaraní. Especímenes de ciencias naturales. Objetos personales de los fundadores, armas, etc. Documentación desde 1880.",1987,,,
300844,38,38063180,,MA-MUSEOS_AR-OSM-0598,Jujuy,San Pedro,,,,,,,,-33.683421,-59.669756,Casa Museo Fernando García Curten,Mitre 1574,B2930ABP,03329,427352,,,,Mixta,1992,"Esculturas, pinturas y grabados de Fernando García Curten.",1993,,,
300853,38,38021060,,MA-MUSEOS_AR-OSM-0599,Jujuy,San Salvador de Jujuy,,,,,,,,-24.183101,-65.307042,Museo Y Centro Cultural Casa Macedonio Graz,Lamadrid Esq. Güemes,Y4600EDA,0388,4310405,,,,,,,,,,
300854,38,38021060,,MA-MUSEOS_AR-OSM-0600,Jujuy,San Salvador de Jujuy,,,,,,,,-24.183245,-65.298692,Museo De Bellas Artes Jorge Mendoza,Avenida  Urquiza 410,Y4600AQD,0388,4220149,,,,Municipal,,,,,,
300855,38,38021060,,MA-MUSEOS_AR-OSM-0601,Jujuy,San Salvador de Jujuy,,,,,,,,-24.184413,-65.309044,Museo En Maquetas Tupac Amaru,Alvear 1152,Y4600AJP,,,,,,,,,,,,
300856,38,38021060,,MA-MUSEOS_AR-OSM-0602,Jujuy,San Salvador de Jujuy,,,,,,,,-24.184473,-65.298938,Museo De Ciencias Naturales Carlos Darwin - Colegio Nacional Nº1 Teodoro Sánchez De Bustamante,Gorriti 353,Y4600DXG,0388,4233599,,,,Provincial,,"Alrededor de trece mil piezas dispuestas en tres salas. Su patrimonio está integrado por material arqueológico, antropológico y piezas de mineralogía y biología. También cuenta con una biblioteca especializada y sala de estudio, taller y laboratorio.",,,,
300857,38,38021060,,MA-MUSEOS_AR-OSM-0603,Jujuy,San Salvador de Jujuy,,,,,,,,-24.185225,-65.300154,Museo Catedral,Sarmiento Esq. Belgrano,Y4600DYF,0388,4226569,,,,Privada,,,,,,
300858,38,38021060,,MA-MUSEOS_AR-OSM-0604,Jujuy,San Salvador de Jujuy,,,,,,,,-24.186419,-65.300074,Museo Y Centro Cultural Culturarte,San Martín Esq. Sarmiento,Y4600ADJ,0388,4249539,,,,,,,,,,
300859,38,38021060,,MA-MUSEOS_AR-OSM-0605,Jujuy,San Salvador de Jujuy,,,,,,,,-24.1852,-65.3001,Museo Histórico Policial,Belgrano 493,Y4600ABG,0388,4237764,,,,Provincial,1994,"El museo está ubicado en las dependencias del antiguo edificio del Cabildo Jujeño -Monumento Histórico Nacional. Cuenta con cuatro salas donde se exhiben uniformes antiguos, armas de alto calibre, armas blancas, explosivos y documentos sobre delincuencia",1994,,,
300860,38,38021060,,MA-MUSEOS_AR-OSM-0606,Jujuy,San Salvador de Jujuy,,,,,,,,-24.185158,-65.302111,Museo De Arte Sacro San Francisco,Belgrano 677,Y4600ABK,0388,4233434,,,,Privada,,"Elementos artísticos de fondos propios de la Orden Franciscana. Pintura e imaginería Cuzqueña, mobiliario sacro de los siglos XVII y XVIII, objetos litúrgicos Coloniales y ornamentos Europeos.",2000,,,
300861,38,38021060,,MA-MUSEOS_AR-OSM-0607,Jujuy,San Salvador de Jujuy,,,,,,,,-24.1859,-65.3028,Museo Histórico Provincial,Lavalle 256,Y4600EAF,0388,4221355,,,,Provincial,1943,"En sus salas se presentan distintos aspectos de la historia Argentina. En la sala Éxodo e independencia se guardan trofeos de la Batalla de Suipacha, cartas del Gral. Belgrano y cuadros de la época. Sala dedicada a Sara Blas de Zenarruza -quién heredó la",1943,,,
300862,38,38021060,,MA-MUSEOS_AR-OSM-0608,Jujuy,San Salvador de Jujuy,,,,,,,,-24.1837,-65.303,Museo Arqueológico Provincial,Lavalle 434,Y4600EAJ,0388,4310693,,,,Provincial,1994,"Piezas pertenecientes a las Culturas Omaguaca, San Francisco, Yavi e Incaica. Cerámicas que datan de más de 2.600 años, colecciones líticas de puntas de flecha, vasijas decoradas. Alberga también la Colección Massing, conformada por objetos del período i",1994,,,
300863,38,38021060,,MA-MUSEOS_AR-OSM-0609,Jujuy,San Salvador de Jujuy,,,,,,,,-24.179,-65.3431,"Museo De Geología, Mineralogía Y Paleontología",Avenida  Bolivia 1661,Y4600GNE,0388,4221593,,,,Nacional,1946,"Colecciones de minerales, rocas y fósiles de la provincia de Jujuy y del mundo -Egipto, EE.UU, España, Gran Bretaña, México. Paneles didácticos explicativos de los diferentes procesos geológicos.",2000,,,
300919,38,38094050,,MA-MUSEOS_AR-OSM-0610,Jujuy,Tilcara,,,,,,,,-23.577896,-65.394028,Museo Ojito De Agua,Jujuy 558,Y4624APL,0388,155812490,,,,,,,,,,
300920,38,38094050,,MA-MUSEOS_AR-OSM-0611,Jujuy,Tilcara,,,,,,,,-23.580989,-65.397861,Museo De Ermitas Tilcareñas,Rivadavia S/n,Y4624AYL,0388,4234386,,,,,,,,,,
300921,38,38094050,,MA-MUSEOS_AR-OSM-0612,Jujuy,Tilcara,,,,,,,,-23.580989,-65.397861,Pucará,"Pucara s/n (a 1 Km de Tilcara, En La Margen Izquierda del Río Grande)",Y4624BIA,0388,4955006,,,,Nacional,,Este sitio arqueológico es testimonio de una prolongada ocupación prehispánica en el área -siglo IX al XVI D. C.- que se ve interrumpida por la conquista Europea. Su superficie es de aproximadamente ocho hectáreas y a lo largo del recorrido se puede acce,,,,
300922,38,38094050,,MA-MUSEOS_AR-OSM-0613,Jujuy,Tilcara,,,,,,,,-23.580989,-65.397861,Museo Medardo Pantoja,Alberro 560,Y4624ADL,0388,154783241,,,,Privada,1977,"Obra de Medardo Pantoja, oriundo de Tilcara y uno de los artistas más representativas de la pintura Latinoamericana. Sus obras reflejan el paisaje, la gente y las costumbres del Norte Argentino.",1977,,,
300923,38,38094050,,MA-MUSEOS_AR-OSM-0614,Jujuy,Tilcara,,,,,,,,-23.576956,-65.394673,Museo De Bellas Artesfundación Hugo Irureta,Belgrano y Bolívar,Y4624AFH,0388,4955124,,,,Privada,1991,"Pinturas, dibujos, grabados y esculturas de artistas argentinos y extranjeros. Las obras argentinas están comprendidas entre los años 1920 y nuestros días.",,,,
300924,38,38094050,,MA-MUSEOS_AR-OSM-0615,Jujuy,Tilcara,,,,,Museo Nacional,DNM,No,-23.576974,-65.393049,Museo Regional de Pintura José Antonio Terry,Rivadavia 352,Y4624AYH,,+54 388 495 5005,museoterry@hotmail.com,https://museoterry.cultura.gob.ar/,propios,Nacional,1958,"El Museo Regional de Pintura ""José Antonio Terry"" funciona en lo que fuera la casa del pintor homónimo. En las salas del museo se exhiben las distintas etapas de la obra de Terry: desde sus primeras pinturas de líneas clásicas -en las que exploró las morfologías humanas- hasta las obras que realizó en Tilcara, con una nueva paleta de colores y en las que destacó las formas de vida en el pueblo, las comidas, la vestimenta y los rasgos de sus habitantes. Mobiliario, fotografías, óleos y documentos ponen de manifiesto la mirada del artista sobre la cultura tilcareña de principios de siglo XX.",1966,Mar a sáb de 9 a 18 hs. Dom/feriados de 9 a 12 y 14 a 18 hs. ,,
300925,38,38094050,,MA-MUSEOS_AR-OSM-0616,Jujuy,Tilcara,,,,,,,,-23.576811,-65.395368,Museo Arqueológico Dr. Eduardo Casanova,Belgrano 445,Y4624AFI,0388,4955006,,,,Nacional,,"Objetos arqueológicos de distintas áreas del mundo nndino, abarcando un amplio panorama de las culturas prehispánicas más representativas de los actuales Perú, Chile, Bolivia y el Noroeste Argentino. Asimismo, con el objetivo de vincular el pasado con el",1968,,,
300926,38,38094050,,MA-MUSEOS_AR-OSM-0617,Jujuy,Tilcara,,,,,,,,-23.577215,-65.393509,Museo De Escultura Ernesto Soto Avendaño,Belgrano 577,Y4624AFK,0388,4955354,,,,Provincial,1967,"El museo está ubicado en la casa donde vivió el Coronel Manuel Álvarez Prado. Se exhiben esculturas en yeso del artista Ernesto Soto Avendaño, entre las que se destacan ""Cansancio"", ""La pena"", ""Trabajo"", y una maqueta que reproduce en un décimo de su tam",1974,,,
300951,38,38098040,,MA-MUSEOS_AR-OSM-0618,Jujuy,Tumbaya,,,,,,,,-23.864688,-65.472178,Museo Cecilio Bustamante,"Coronel Quintana, Esq. Buenos Aires S/n",4618,0388,4996015,,,,Privada,2005,"Piezas de culturas precolombinas, objetos de la vida cotidiana de fines del siglo XIX y principios del XX, libros antiguos, fotografías conmemorativas, pinturas, colección de monedas, pinturas de calles de Tumbaya realizadas por Alfonso Maidana.",2005,,,
300956,38,38028060,,MA-MUSEOS_AR-OSM-0619,Jujuy,Uquia,,,,,,,,-23.31883,-65.348666,Museo Familiar Dora Arancibia,Mariano Arancibia S/n,Y4626XAD,,,,,,,,"La casa de Dora Arancibia, hoy convertida en museo, da a conocer la historia de esta magnífica mujer, recibida de maestra en 1930, que dedicó su vida a enseñar en los lugares mas inhóspitos de la Quebrada de Humahuaca y a trabajar para la comunidad de su",,,,
300957,38,38028060,,MA-MUSEOS_AR-OSM-0620,Jujuy,Uquia,,,,,,,,-23.31883,-65.348666,Museo Takashi Takahashi,Cátulo Aparicio S/n,Y4626XAD,0388,4230901,,,,,,carga metros cubicvos camion cereales,,,,
301043,38,38112080,,MA-MUSEOS_AR-OSM-0621,Jujuy,Yavi,,,,node/3631895170,,,,-22.136021,-65.465489,Museo Histórico Provincial Casa Hacienda de Yavi del Marquesado de Tojo,,4651,03887,491138,casadelmarques@hotmail.com,,,Municipal,,"La casa fue una de las principales posesiones del Marquesado de Tojo, el cual perduró hasta 1813, cuando se abolieron los títulos nobiliarios. Destruida y saqueada en sucesivas oportunidades durante las Guerras de la Independencia y civiles, es Patrimonio Histórico Nacional",,,1708 construcción edificio,
301044,38,38112090,,MA-MUSEOS_AR-OSM-0622,Jujuy,Yavi Chico,,,,,,,,-22.095868,-65.467108,Museo Mama Antonia - Tata Portal,Comunidad Aborigen Yavi Chico,Y4651XAG,,,,,,,1998,"Colección arqueológica rescatada del sitio arqueológico de Yavi Chico, conformada por vasijas, piedras de moler, puntas de flecha y elementos de la vida cotidiana recuperadas del Antigal, que se encuentra a veinte minutos de Yavi Chico.",2008,,,
300012,42,42070010,,MA-MUSEOS_AR-OSM-0623,La Pampa,Alpachiri,,,,,,,,-37.378175,-63.773905,Museo Histórico Municipal De Alpachiri,Ceballos s/n - Estación de Ferrocarril-,L6309AEA,02953,497102,,,,Municipal,,"Elementos pertenecientes a antiguos pobladores: ruecas, máquinas de coser y de hilar, vestimenta, mobiliario, patentes de rodados, chapones identificadores de calles de la localidad, objetos religiosos, instrumentos musicales, elementos de labranza, radi",,,,
300016,42,42133020,,MA-MUSEOS_AR-OSM-0624,La Pampa,Alta Italia,,,,,,,,-35.333615,-64.119272,Museo Histórico Municipal,Aristóbulo del Valle 351,L6207AEG,02302,491168,,,,Municipal,2003,Objetos vinculados a la historia de la localidad de Alta Italia. Las colecciones proceden predominantemente de donaciones de los pobladores locales o de compras realizadas por el municipio.,2005,,,
300032,42,42147010,,MA-MUSEOS_AR-OSM-0625,La Pampa,Arata,,,,,,,,-35.637447,-64.355767,Museo Histórico De Arata,Libertad 250,L6385AGF,02335,498052,museoarata@hotmail.com,,,Municipal,,"Ubicado en el antiguo almacén de ramos generales ""La Florida"", su colección consta de objetos históricos cedidos por distintas instituciones de la localidad, tales como la iglesia, el correo y la escuela. Posee un patio al aire libre con carruajes, autos",2005,,,
300068,42,42077020,,MA-MUSEOS_AR-OSM-0626,La Pampa,Bernasconi,,,,,,,,-37.904348,-63.745111,Museo Lucio V. Mansilla,Avenida  San Martín S/n,L8204AFB,02925,499222,,,,Privada,1967,Colecciones de minerales de la dirección nacional de minas y geología de Catamarca. Objetos de antiguos comercios y primeros pobladores. Fotografías de familias pioneras y de la localidad de Bernasconi en sus inicios. Objetos arqueológicos y etnográficos,1968,,,
300096,42,42098010,,MA-MUSEOS_AR-OSM-0627,La Pampa,Carro Quemado,,,,,,,,-36.477883,-65.342926,Museo Histórico Familiar Orgales,Sobre Ruta Nº 105,6319,02338,496012,,,,Privada,,Emplazado en un edificio de chapa que funcionó como boliche. Pertenece a una familia de la zona y exhibe tanto su forma de edificación como los objetos que se comercializaban en el mismo.,,,,
300097,42,42098010,,MA-MUSEOS_AR-OSM-0628,La Pampa,Carro Quemado,,,,,,,,-36.477883,-65.342926,Museo Atelier Antonio Ortiz Echagüe,"Establecimiento ""la Holanda""",6319,02338,496038,,,,Mixto Provincial y Privado,1940,"Pinturas de Ortiz Echagüe del período 1910 -1940. En 1990, Federico Echagüe, hijo del pintor, donó a la provincia el atelier y una parcela de tres hectáreas en la estancia ""La Holanda"" para que funcione el museo. Por voluntad del pintor la mayoría de sus",1905,,,
300104,42,42056020,,MA-MUSEOS_AR-OSM-0629,La Pampa,Ceballos,,,,,,,,-35.272157,-63.770872,Museo De La Biblioteca Popular Francisco Ceballos,Ruta Provincial N° 13 Km 80,6221,02954,473237,,,,Privada,1999,"El museo es un espacio para la memoria de los antiguos pobladores, donde los elementos olvidados encuentran su valor. También exhibe una colección de piezas de taxidermia, realizadas por el fallecido artista Alejandro Cabrera, que muestran la diversidad",2012,,,
300266,42,42112020,25 de Mayo La Pampa,MA-MUSEOS_AR-OSM-0630,La Pampa,Colonia 25 de Mayo,,,,,,,,-37.769862,-67.711631,Museo Geominero Don José Cholino,Ruta Provincial Nº 4 Parque Industrial,8201,0299,4948177,,,,Privada,,"Muestras de minerales y fósiles de la zona, el país y el mundo; algas unicelulares con una antigüedad de 3.500 millones de años procedentes de la Patagonia Argentina, pez fosilizado procedente de Italia de 54 millones de años de antigüedad, etc.",,,,
300267,42,42119010,,MA-MUSEOS_AR-OSM-0631,La Pampa,Colonia Barón,,,,,,,,-36.151608,-63.859309,Museo Colonia Barón,San Martín 345,L6315AFC,02333,476201,,,,Municipal,,"Resguarda la historia del pueblo a través de fotografías, objetos y documentos. Máquina de hilar, hoz, prensa para queso, cocina, plancha a carbón; instrumentos musicales; numismática; mobiliario de peluquería y diversos objetos pertenecientes a un almac",1999,,,
300270,42,42154030,,MA-MUSEOS_AR-OSM-0632,La Pampa,Colonia Santa María,,,,,,,,-37.497534,-64.224905,La Casa Museo De Los Abuelos Guinder,San Martín S/n,8214,02952,493024,,,,Privada,,"Casa museo privada, atendida por sus dueños con objetos pertenecientes a la familia de origen alemán",,,,
300289,42,42035010,,MA-MUSEOS_AR-OSM-0633,La Pampa,Conhelo,,,,,,,,-36.001818,-64.595944,Museo Agrario José A. Gaillaurdou,Estación del Ferrocarril,L6381XAI,02334,482001,,,,Municipal,,En los terrenos del ferrocarril se presenta un museo abierto que muestra la tecnología utilizada para las labores agrícolas de la zona.,,,,
300309,42,42056030,,MA-MUSEOS_AR-OSM-0634,La Pampa,Coronel Hilario Lagos,,,,,,,,-35.023499,-63.91073,Museo Perito Francisco P. Moreno,San Martín N° 77,L6228AKC,02331,495049,,,,Privada,1974,Las piezas se exhiben en locales comerciales y representan el pasado y presente de los habitantes de Coronel Hilario Lagos y sus actividades en la región.,,,,
300332,42,42105020,,MA-MUSEOS_AR-OSM-0635,La Pampa,Dorila,,,,,,,,-35.778659,-63.716875,Museo Histórico Dorila,Calle 10 Esquina 3,L6365XAJ,02302,480101,,,,Mixta,2011,"Museo con historia de familias locales o que han pertenecido a esta localidad. Con variedad de elementos: utensilios de cocina y muebles de cocina, fotografías, ropa y moblaje de habitación, dormitorio, revistas y libros, radios,etc. Edificación del muse",2011,,,
300333,42,42035020,,MA-MUSEOS_AR-OSM-0636,La Pampa,Eduardo Castex,,,,,,,,-35.918922,-64.294612,Museo Histórico Municipal Juan Ricardo Nervi,Rivadavia S/n,6380,,,,,,Municipal,,Testimonia el origen y la cotidianeidad de los primeros pobladores de Eduardo Castex.,2002,,,
300346,42,42133040,,MA-MUSEOS_AR-OSM-0637,La Pampa,Embajador Martini,,,,,,,,-35.387425,-64.282639,Museo Municipal Néstor Tellería,Estación del Ferrocarril,,02335,495287,,,,Municipal,,"Muebles y objetos históricos de los pobladores, mobiliario del ferrocarril y obras plásticas de N. Tellería, pueden observarse en este museo localizado en la estación del ferrocarril.",,,,
300359,42,42133050,,MA-MUSEOS_AR-OSM-0638,La Pampa,Falucho,,,,,,,,-35.191432,-64.103902,Museo Del Centenario,Acceso Ricardo Lavalle 298,6215,02331,499337,,,,Municipal,2012,"Se exhiben elementos de la vida cotidiana -vajilla, máquinas de amasar, máquina de hacer manteca e importante cantidad de bordados realizados por la gente de la localidad-; elementos característicos de las instituciones locales; reproductores de música,",2008,,,
300388,42,42105030,,MA-MUSEOS_AR-OSM-0639,La Pampa,General Pico,,,,,,,,-35.663726,-63.756706,Museo Regional Maracó,Calle 17 N° 560,L6360BAL,02302,421043,,,,Municipal,1966,"Las colecciones hacen referencia a la fundación de la ciudad de Gral. Pico, sus primeras instituciones, la llegada del ferrocarril y la vida municipal. Fotografías, mobiliario, herramientas, vajilla, vestimenta, instrumentos musicales y utensilios de div",1971,,,
300395,42,42077030,,MA-MUSEOS_AR-OSM-0640,La Pampa,Gral. San Martín,,,,,,,,-37.97802,-63.599256,Museo Aldo Pato Hernando,Pasteur 17,L8206BAA,02925,497244,,,,Privada,,"El museo debe su nombre al reconocido ciclista Aldo Oscar Hernando, campeón juvenil pampeano en la década de 1950. Su acervo está compuesto por piezas de colección de variada índole, como motores, motos, bicicletas, patentes, marcas de autos, artículos a",,,,
300396,42,42077030,,MA-MUSEOS_AR-OSM-0641,La Pampa,Gral. San Martín,,,,,,,,-37.980807,-63.606618,Museo Villa Alba,Predio del Ferrocarril Calle Rivadavia,8206,02925,497220,,,,Municipal,,"Presenta testimonios relativos a la historia de la localidad de Gral. San Martín, tales como máquinas de escribir, cajas registradoras, fotocopiadoras, tocadiscos, fotografías y objetos varios, instrumentos musicales, libros, cuadros, escudos, carruajes",,,,
300406,42,42070030,,MA-MUSEOS_AR-OSM-0642,La Pampa,Guatraché,,,,,,,,-37.668687,-63.532756,Museo Y Archivo Histórico,Sarmiento S/n,,02924,492498,andreaverna@yahoo.com.ar,,,Municipal,,"El edificio fue la primera comisaría de la localidad. Alberga una colección heterogénea compuesta por elementos de la vida cotidiana, sus instituciones, una sala destinada a elementos arqueológicos y otra a una colección de paleontología de aproximadamen",,,,
300423,42,42133060,,MA-MUSEOS_AR-OSM-0643,La Pampa,Ingeniero Luiggi,,,,,,,,-35.386097,-64.468592,Museo Histórico Municipal,9 de Julio s/n - Estación del Ferrocarril,6205,02335,472155,,,,Municipal,1999,"Objetos que representan la historia de la localidad de Ingeniero Luiggi: vestimenta, mobiliario, elementos de uso doméstico, máquinas agrícolas de fines del siglo XIX; sala con fotografías del pueblo; piezas de aborígenes pampeanos.",1999,,,
300426,42,42077050,,MA-MUSEOS_AR-OSM-0644,La Pampa,Jacinto Arauz,,,,,,,,-38.086033,-63.432217,Museo Histórico Del Médico Rural Dr. René G. Favaloro,Estación del Ferrocarril,8208,02925,493224,,,,Municipal,,"Elementos pertenecientes a los distintos médicos que trabajaron en Jacinto Arauz. Mobiliario, instrumental médico, libros. Una sala dedicada al Dr. René Favaloro, que rememora su trabajo como médico rural en la localidad entre los años 1950 y 1961.",2003,,,
300529,42,42133030,Damián Maisonave La Pampa,MA-MUSEOS_AR-OSM-0645,La Pampa,Maisonnave,,,,,,,,-35.043911,-64.384737,Museo Chacarero La Loma,"Lote Dos, Fracción A, Sección 1. Ruta Nac. 188",6212,02331,460182,,,,Privada,,"El museo homenajea a los antepasados chacareros que labraron las tierras. Exhibe al aire libre elementos representativos de la historia agrícola de la zona, entre ellos, alrededor de 40 máquinas agrarias de la época de tracción a sangre, como arados, ras",,,,
300530,42,42133030,Damián Maisonave La Pampa,MA-MUSEOS_AR-OSM-0646,La Pampa,Maisonnave,,,,,,,,-35.04149,-64.385838,Museo Juan Antonio Cantarella,,,02331,491004,mccantarella@hotmail.com,,,Privada,,"Colección formada por elementos que Juan Antonio Cantarella reunió a través de los años y que son testimonio del pasado de la localidad de Maissonave, entre los que figuran relojes, candados, almanaques con imágenes de Molina Campos y otros recuerdos rep",,,,
300558,42,42119030,,MA-MUSEOS_AR-OSM-0647,La Pampa,Miguel Cané,,,,,,,,-36.157284,-63.512191,Museo Colegio Gral. Don Martín Miguel De Güemes,Belgrano S/n,6331,02333,498046,,,,Privada,2001,"Museo escolar, creado por los alumnos, que exhibe y conserva objetos del patrimonio cultural local y zonal. Desde que comenzó sus actividades -2001- se desarrollaron contenidos de casi todas las áreas de conocimiento, cumpliendo así una importante funció",2001,,,
300559,42,42007030,,MA-MUSEOS_AR-OSM-0648,La Pampa,Miguel Riglos,,,,,,,,-36.853739,-63.688501,Museo Casa Vicente,Avenida  Belgrano 573,L6301ABF,02953,498163,,,,Municipal,,"Esta antigua casa de comercio hoy transformada en museo, muestra desde la fauna local a elementos utilizados por los pobladores en distintas épocas con representaciones y dioramas, máquinas utilizadas para la agricultura y el transporte.",,,,
300601,42,42126040,,MA-MUSEOS_AR-OSM-0649,La Pampa,Parera,,,,,,,,-35.147366,-64.501007,Museo El Tordillo,Avenida  San Martín N° 434,L6213ALJ,02331,497152,,,,Mixta-Privada/Municipal,1969,"Museo polifacético que abarca áreas como la numismática, la arqueológica y la histórica, entre otras. Fósiles petrificados, restos de gliptodontes, piedras indígenas de uso doméstico y de caza, armas, herramientas agrícolas, ganaderas e industriales.",2008,,,
300642,42,42154050,,MA-MUSEOS_AR-OSM-0650,La Pampa,Quehué,,,,,,,,-37.121895,-64.515322,Museo Municipal Casa Sarasola,Paseo de La Estación,,02952,499010,,,,Municipal,,En la casa de una antigua familia de la localidad se muestran objetos de sus pobladores.,,,,
