300977,62,62007090,,MA-MUSEOS_AR-OSM-0813,Río Negro,Viedma,,,,,,,,-40.8103,-62.9925,Museo Tecnológico del Agua y del Suelo Ing. O. Casamiquela,"Colón 498, 1er Piso",R8500AFDJ,02920,426096,museodpa@yahoo.com.ar,www.museo-dpa.blogspot.com,,Provincial,1984,"Colecciones referidas a la utilización del agua y el suelo: material fotográfico y cartográfico sobre construcción y evolución de las obras; maquetas y objetos referidos a modos de obtención del agua; estudios hidrometeorológicos y de suelo, potabilizaci",,,,
301011,62,62021100,,MA-MUSEOS_AR-OSM-0814,Río Negro,Villa Los Coihues,,,,,,,,-41.159763,-71.41309,Museo Del Lago Gutiérrez Dr. Rosendo Pascual,Bosque Petrificado 365 Villa Los Cohiues - Lago Gutiérrez,8400,02944,467578,proterocarsinuscorsolini@yahoo.com.ar,www.museolagogutierrez.com.ar,,Privada,1999,"Colección de geología -cristales- y de paleontología de la Patagonia. Cuenta con parte del esqueleto de un reptil marino del período jurásico -Pliosaurio- y una importante colección de invertebrados marinos de la Patagonia, además de flora, insectos, anu",1999,,,
301022,62,62042560,,MA-MUSEOS_AR-OSM-0815,Río Negro,Villa Regina,,,,,,,,-39.094907,-67.088747,Museo Comunitario Villa Regina,Uruguay 165,R8336AWC,02941,464550,municpalidad@villaregina.gov.ar / apotesmungai@villaregina.gov.ar,,,Municipal,1991,"El museo comunitario, también edificio histórico, alberga un acervo relacionado con los años fundacionales de Villa Regina, en la década de 1920, y piezas de arqueología prehistórica -colección de raspadores, raederas, puntas de flechas, punzones, morter",1996,,,
,,,,MA-MUSEOS_AR-OSM-1106,Río Negro,San Antonio Este,,,,node/4429597089,,,,"-40,8041512","-64,8835483",Museo 'Ellio Nazareno Quattrocchi',,,,,,,,Privado,2014,"En sus vitrinas y anaqueles exhibe objetos antiguos de la vida cotidiana, herramientas rurales, objetos de náutica, sellos postales, juguetes, botellas y una infinidad de utensilios",,,,
,,,,MA-MUSEOS_AR-OSM-1108,Río Negro,Viedma,,,,node/1608982627,,,,"-40,8104783","-62,9921229",Museo Salesiano Cardenal Cagliero,Rivadavia 34,8500,,+54 2920 15613355,,,,,1980-02-31,"El objetivo del museo es expresar la actividad desarrollada por los salesianos en la faz religiosa, educativa, sanitaria y cultural, mediante los numerosos testimonios que conserva. Como uno de sus tesoros más preciados, el museo presenta la que fuera la",,,,
,,,,MA-MUSEOS_AR-OSM-1109,Río Negro,Viedma,,,,node/7820957316,,,,"-40,8070341","-62,9951976",Museo Histórico Provincial 'Eugenio Tello',San Martín 360,8500,,,,,,Provincial,,,,,,
,,,,MA-MUSEOS_AR-OSM-1110,Río Negro,Viedma,,,,node/3643587358,,,,"-40,8106045","-62,9919711",Museo Gardeliano Lisandro Segovia,Rivadavia 58,8500,,+54 2920 15-47-3714,,https://www.facebook.com/museogardelianoviedma/,,Privado,,,,,,
300024,66,66154010,,MA-MUSEOS_AR-OSM-0817,Salta,Angastaco,,,,,,,,-25.686295,-66.163005,Museo Arqueológico Prof. Néstor A. Grau,Centro Cívico Municipal Poeta Manuel J. Castilla S/n,4427,03868,491123,,,,,,"Hachas, vestigios de puntas de flecha, pucos y pequeñas ollas y urnas. Se exhiben mayoritariamente elementos de la vida cotidiana. Las piezas se recuperaron de un cementerio ubicado a tres kilómetros de Angastaco.",,,,
300071,66,66014010,,MA-MUSEOS_AR-OSM-0818,Salta,Cachi,,,,,,,,-25.122737,-66.167946,Museo Arqueológico Pío Pablo Díaz,Juan Calchaquí S/n,4417,03868,491080,museodecachi@yahoo.com.ar,,,Provincial,,"El museo arqueológico fue creado en 1969, en base a las colecciones arqueológicas donadas por Don Pío Pablo Díaz, con una clara misión fundacional: el desarrollo de la investigación, la conservación y la divulgación. Esta institución se destaca por posee",,,,
300072,66,66021010,,MA-MUSEOS_AR-OSM-0819,Salta,Cafayate,,,,,,,,-26.07598,-65.975652,Museo De La Vid Y El Vino,Avenida Güemes Sur 280,A4427AQP,03868,422442,,,,Municipal,1985,"Historia de la producción vitivinícola en Cafayate, desde sus orígenes hasta la década de 1990. Maquinaria antigua, elementos de transporte de fines de siglo XIX, carpintería para realizar los toneles y objetos empleados en la elaboración del vino. Gráfi",,,,
300073,66,66021010,,MA-MUSEOS_AR-OSM-0820,Salta,Cafayate,,,,,,,,-26.074623,-65.978178,Museo Regional Y Arqueológico Rodolfo F. Bravo,Colón 191,A4427AMC,03868,421054,,,,Privada,1939,"Material reunido por Rodolfo I. Bravo, extraído de un radio de 30 km. alrededor de Cafayate. Muestra de paleontología de restos fósiles vegetales y animales -mastodontes y gliptondontes. Objetos líticos tales como hachas, flechas y puntas de lanza de las",1939,,,
300079,66,66056020,,MA-MUSEOS_AR-OSM-0821,Salta,Campamento Vespucio,,,,,,,,-22.582665,-63.852372,Museo Regional De Ciencias Naturales Prof. Rodolfo P. Bustos,Avenida  San Martín 313,A4563AWG,0387,4373109,,,,Provincial,,"Restos paleontológicos de Stegomastodontes, Megaterios y Gliptodontes, especies de dinosaurios pertenecientes al período Cuaternario. Piezas cerámicas y líticas; restos humanos y otra serie de elementos en estado de fosilización, en su mayoría rescatados",,,,
300081,66,66049010,,MA-MUSEOS_AR-OSM-0822,Salta,Campo Santo,,,,,,,,-24.677818,-65.104687,Museo De Campo Santo,"San Martín y Gral. Güemes, Frente A La Plaza Central",A4432XAB,0387,156851895,,,,Mixta,,"Resguarda piezas arqueológicas de la cultura San Francisco, primeros habitantes de esta zona,  con influencia de las culturas La Candelaria, Humahuaca y Condorhuasi. Este museo surgió en consecuencia de hallazgos arqueológicos en la Central Térmica Termo",,,,
,,,,MA-MUSEOS_AR-OSM-0850,Salta,El Tala,,,,,,,,,,"Museo Precolombino y de Antigüedades ""Lola Mora""",Avenida San Martín Esquina 25 de Mayo. s/n,A4126XAT,,+54  3876 668531,secretariadecultura.eltala@outlook.com,,,,," El Museo Lola Mora se encuentra en el edificio histórico ""El Solar de Lola Mora"", donde funciona la Secretaría de Cultura y Turismo de la Municipalidad de El Tala. Está dividido en 2 salas, en la sala Gral. Martín Miguel de Güemes se exhiben piezas arqueológicas de la era precolombina, y en la sala Gral. Manuel Belgrano se exponen piezas antiguas, entre ellas las pertenecientes a la artista Lola Mora, nacida en esta ciudad. ",,Lunes a Viernes de 08 a 13 hs.,,
300367,66,66028050,Código en Salta Capital,MA-MUSEOS_AR-OSM-0823,Salta,Finca la Cruz,,,,,,,,-22.432365,-65.167985,Museo De La Vida Rural Salteña Finca La Cruz,"Camino A La Quesera y A La Troja, A 23 Km de La Ciudad de Salta",A4400XAP,0387,4214714,,,,Provincial,1982,"Su sede es un edificio del siglo XVIII, declarado Monumento Histórico Nacional. En él se pueden apreciar instrumentos de labranza, armas, mobiliario, objetos de uso doméstico, retratos de figuras relevantes de la época de la independencia, fotografías, h",1982,,,
300567,66,66119020,,MA-MUSEOS_AR-OSM-0824,Salta,Molinos,,,,,,,,-25.446811,-66.308844,Museo De Arqueología Del Churcal,"Abraham Cornejo S/n, Hacienda de Molinos",4419,03868,494094,,,,Privada,,"En sus dos salas se exhiben cerámicas y elementos líticos hallados en la localidad de El Churcal. Puntas de flecha, hachas, vasijas utilitarias y de decoración.",,,,
300727,66,66140050,,MA-MUSEOS_AR-OSM-0825,Salta,Rosario De La Frontera,,,,,,,,-25.811457,-64.984083,Museo Histórico Arqueológico Prof. Juan Carlos Rivas,"Melchora F. de Cornejo 650, Predio de La Escuela Normal",A4190BEN,03876,481814,,,,Provincial,,"Posee utensilios líticos, cerámica de las culturas Candelaria y Diaguita y piezas de la época colonial.",,,,
300728,66,66140050,,MA-MUSEOS_AR-OSM-0826,Salta,Rosario De La Frontera,,,,,,,,-25.800419,-64.975482,Museo-Escuela Provincial De Bellas Artes Quinquela Martin,San Martín 345,A4190ABD,03876,482622,,,,Provincial,1972,"Esculturas, pinturas, dibujos y grabados de artistas argentinos de mediados del siglo XX. Obras de Noé, Da Prato, Sonzabriano, Pablo Tenti, Luis Perlotti, Luis Borraro, Torcuato Tasso, Agustín Riganelli, Antonio Pujía, Ernesto Scotti, Juan Carlos Iramaín",1972,,,
300735,66,66028050,,MA-MUSEOS_AR-OSM-0827,Salta,Salta,,,,,,,,-24.769133,-65.421799,Biblioteca Y Museo Histórico Del Regimiento De Caballería  De Exploración 5  Grl Güemes,Avenida  Arenales s/n (al Lado del Hospital Militar),4400,0387,4318204,,,,Nacional,,"En la exposición permanente de la colección patrimonial del museo encontramos: uniformes, banderas, estandartes, armas, elementos de campaña, documentos y fotografías, entre otras piezas. De las cuales las piezas más destacadas son:  el pretal de plata",,,,
300736,66,66028050,,MA-MUSEOS_AR-OSM-0828,Salta,Salta,,,,,,,,-24.779244,-65.412717,Museo De Arte Étnico Americano Pajcha,20 de Febrero 838,A4400EMR,0387,4229417,,,,Privada,,"Arte Americano de la región Andina, Chaqueña y Mapuche. Imaginería del siglo XX, colección de máscaras. Arte Maya, Kuna, Emberá, Afrobrasilero, Kallawaya, entre otros. También cuenta con piezas Preincaicas: maderas, plumas, joyas y tejidos.",,,,
300737,66,66028050,,MA-MUSEOS_AR-OSM-0829,Salta,Salta,,,,,,,,-24.786601,-65.398186,Museo De Antropología De Salta,Ejército del Norte y Ricardo Solá,4400,0387,4222960,,,,Provincial,,El museo de antropología de Salta fue inaugurado el 21 de abril de 1975 como Museo Arqueológico de Salta y su primer director fue el Prof. Amadeo Sirolli.  El edificio cuenta con salas amplias distribuidas en dos plantas donde se expone parte de  la impo,,,,
300738,66,66028050,,MA-MUSEOS_AR-OSM-0830,Salta,Salta,,,,,,,,-24.788858,-65.410844,Museo De Arqueología De Alta Montaña,Bartolomé Mitre 77,A4400EHA,0387,4370499,,,,Provincial,,La muestra principal gira alrededor del hallazgo de tres niños incas y su ajuar en la cima del Volcán Llullaillaco. También pueden apreciarse testimonios arqueológicos provenientes del Nevado de Quewar y del Cerro Chuscha. El museo cuenta con un área ded,,,,
300739,66,66028050,,MA-MUSEOS_AR-OSM-0831,Salta,Salta,,,,,Museo Nacional,DNM,No,-24.7898,-65.4104,Museo Histórico del Norte,Caseros 549,A4400DMK,,+54 387 4215340,cabildosalta@uolsinectis.com.ar,https://museodelnorte.cultura.gob.ar,propios,Nacional,," El Museo Histórico del Norte está emplazado en el edificio del Cabildo de Salta y forma parte de un complejo museístico integrado por el Museo Pte. José Evaristo Uriburu y el Museo Posta de Yatasto, edificios que datan de los siglos XVII y XVIII. Los tres espacios, declarados Monumentos Históricos Nacionales, proponen un recorrido por la historia de Salta a través de piezas y colecciones del periodo Prehispánico, Colonial e Independiente. ",,Lu-Vie de 9 a 13.30 y de 15 a 19.30 - Sáb. de 14.30 a 18.30- Dom de 9.30 a 13.30,,
300740,66,66028050,,MA-MUSEOS_AR-OSM-0832,Salta,Salta,,,,,,,,-24.79,-65.4085,Museo Presidente José Evaristo Uriburu,Caseros 417,A4400DMI,0387,4218174,cabildosalta@uolsinectis.com.ar,,,Nacional,,"Mobiliario, objetos de usos y costumbres de los siglos XVIII y XIX y principios del XX, entre los que se destacan el escritorio del General Álvarez de Arenales y los retratos del pintor francés Amadeo Gras. Biblioteca ""Monseñor Miguel Ángel Vergara"", esp",,,,
300741,66,66028050,,MA-MUSEOS_AR-OSM-0833,Salta,Salta,,,,,,,,-24.7909,-65.4125,Museo Casa Arias Rengel,La Florida 20,A4402FMB,0387,4214714,mbartes@edusalta.gov.ar,,,Provincial,,"Magnífica casona del siglo XVIII declarada Monumento Histórico Nacional. En ella pueden apreciarse, además de su arquitectura, muestras temporarias de artistas locales, nacionales y extranjeros.",,,,
300742,66,66028050,,MA-MUSEOS_AR-OSM-0834,Salta,Salta,,,,,,,,-24.7909,-65.4125,Museo De  La  Ciudad Casa De Hernández,La Florida 97,A4402FMA,0387,4373352,museocapitalsalta@hotmail.com,,,Municipal,,"El museo presenta en la planta baja la sala Güemes, ambientada con mobiliario de los siglos XVIII y XIX. En la planta alta hay óleos y fotografías pertenecientes a ex intendentes -desde 1857-, mobiliario, cámaras fotográficas, elementos de la vida cotidi",,,,
300743,66,66028050,,MA-MUSEOS_AR-OSM-0835,Salta,Salta,,,,,,,,-24.792204,-65.409865,Museo De Historia De La Universidad Nacional De Salta Prof. Eduardo M. Ashur,Buenos Aires 177,A4402FDC,0387,4325701,,,,Nacional,,"Cuenta con varias exposiciones en soporte fotográfico que analizan especialmente la Salta del siglo XX: la ciudad antigua y la actual, su desarrollo y arquitectura; sus habitantes y costumbres; el impacto de la inmigración; la universidad y su rol.",,,,
300744,66,66028050,,MA-MUSEOS_AR-OSM-0836,Salta,Salta,,,,,,,,-24.7953,-65.4046,Museo De Ciencias Naturales De La Universidad Nacional De Salta,Mendoza 2,A4402AHB,0387,4318086,,,,Nacional,,"El museo muestra las peculiaridades de la fauna del vasto territorio provincial, donde la diversidad es la característica esencial. Colecciones de aves, reptiles, mamíferos e insectos autóctonos. Actualmente cuenta con salas donde se exhiben muestras de",,,,
300745,66,66028050,,MA-MUSEOS_AR-OSM-0837,Salta,Salta,,,,,,,,-24.7888,-65.4068,Museo Folclórico Pajarito Velarde,Pueyrredón 106,A4400EAD,0387,4212921,,,,Privada,,"Funciona en lo que fuera la casa de Guillermo Velarde Mors, conocido como ""Pajarito"", mecenas de la Bohemia Salteña. Pinturas, mobiliario, instrumentos musicales, armas. Recuerdos de artistas, deportistas y personalidades. Objetos relacionados con Carlos",1970,,,
300746,66,66028050,,MA-MUSEOS_AR-OSM-0838,Salta,Salta,,,,,,,,-24.7913,-65.4084,Museo Del Convento San Francisco,Córdoba 15,A4402EZA,0387,310830,,,,Privada,1942,"Mobiliario del siglo XVII, misales, objetos litúrgicos, pinturas, imágenes del siglo XVIII, incunables, entre otros.",1984,,,
300747,66,66028050,,MA-MUSEOS_AR-OSM-0839,Salta,Salta,,,,,,,,-24.786806,-65.416138,Museo De Bellas Artes,Avenida  Belgrano 992,A4400AWU,0387,4318562,,,,Provincial,1986,Arte precolombino; arte mestizo de los siglos XVIII y XIX; obras de artistas europeos del siglo XIX y de artistas argentinos de los siglos XIX y XX. Posee una importante colección de obras de artistas salteños y de la región.,1986,,,
300748,66,66028050,,MA-MUSEOS_AR-OSM-0840,Salta,Salta,,,,,,,,-24.7887,-65.4096,Museo De Arte Contemporáneo,Zuviría 90,A4400EFB,0387,4370498,mac2004@edusalta.gov.ar,,,Provincial,,"Pinturas, dibujos, fotografías, esculturas, grabados e instalaciones de artistas nacionales e internacionales. Como característica esencial, es un espacio interactivo donde las exhibiciones cambian mensualmente, donde muestras individuales pueden ocupar",2004,,,
300757,66,66105020,,MA-MUSEOS_AR-OSM-0841,Salta,San Antonio de los Cobres,,,,,,,,-24.221255,-66.319263,"Museo Antapu, Étnico Y Arqueológico De San Antonio De Los Cobres",Belgrano s/n y Ruta 51,4411,0387,4909912,,,,Privada,,"El museo forma parte del desarrollo de un circuito turístico alternativo, ""El cielo con las manos"", donde la comunidad actúa como gerenciadora de sus propios bienes, su patrimonio cultural y sus bellezas naturales, y ofrece al visitante la oportunidad de",,,,
300761,66,66154040,,MA-MUSEOS_AR-OSM-0842,Salta,San Carlos,,,,,,,,-25.892339,-65.929979,Museo Histórico Regional De San Carlos,General Güemes y Rivadavia,4427,03868,495182,,,,Municipal,1981,"En sus tres salas se exhiben objetos arqueológicos de los períodos Precerámico, Agroalfarero temprano y tardío, Inca e Hispanoindígena; piezas históricas, religiosas y de la vida rural.",1981,,,
300762,66,66154040,,MA-MUSEOS_AR-OSM-0843,Salta,San Carlos,,,,,,,,-27.748309,-55.900069,Museo Jesuítico Y Centro De Documentación,Felipe Vivero E Hipólito Irigoyen,3306,03758,494048,,,,Provincial,1905,"Conserva piezas pertenecientes al Período Jesuítico: herrajes, hachas, candelabros, ollas, esculturas de piedra, pila bautismal, bases de columnas y restos de cerámica europea, del Alto Perú y Guaranítica -previa al Período Hispánico. El centro de docume",1986,,,
300797,66,66112040,San José de Metan (Est. Metan),MA-MUSEOS_AR-OSM-0844,Salta,San José de Metan,,,,,,,,-25.499567,-64.968849,Museo Municipal De Bellas Artes,Lavalle y Güemes,A4440CDC,03876,420262,,,,Municipal,,"Este museo fue creado en 1996 gracias a la donación de las obras que hizo el Profesor Amelio Ronco Cerutti. La colección que dio origen al museo está integrada por dibujos, óleos, aguafuertes, yesos y bronces de autores nacionales. Obras de Primaldo Móna",,,,
300849,66,66126070,,MA-MUSEOS_AR-OSM-0845,Salta,San Ramón de la nueva Orán,,,,,,,,-23.132423,-64.318626,Museo Regional De Orán,Avenida  Vicente López y Planes y San Martín,A4530FUB,03878,421274,,,,Municipal,,"Colecciones geológicas, paleontológicas y arqueológicas pertenecientes a la Selva Tucumano-Oranense. Piezas etnográficas de los grupos aborígenes Wichi, Chané y Colla. Colecciones históricas. Sala dedicada a la historia contemporánea del ferrocarril.",,,,
300891,66,66147030,Código en Rosario de Lerma,MA-MUSEOS_AR-OSM-0846,Salta,Santa Rosa de Tastil,,,,,,,,-24.43333,-65.95,Museo De Sitio Santa Rosa De Tastil,"Santa Rosa de Tastil, Ruta Provincial Nº 51",A4409XBD,,,,,,Provincial,,"Material extraído de excavaciones realizadas en el sitio arqueológico Pre-Incaico de Santa Rosa de Tastil -sitio habitacional y de arte rupestre. Material lítico, ?puntas de flecha e instrumentos de moler? y cerámicas, textiles y metales de uso funerario",,,,
300892,66,66147030,Código en Rosario de Lerma,MA-MUSEOS_AR-OSM-0847,Salta,Santa Rosa de Tastil,,,,,,,,-24.43333,-65.95,Museo Regional Moisés Zerpa,Santa Rosa de Tastil,A4409XBD,,,,,,Privada,1998,"Colecciones de etnografía, geología, ciencias naturales. Pinacoteca.",2000,,,
300968,66,66077020,,MA-MUSEOS_AR-OSM-0848,Salta,Vaqueros,,,,,,,,-24.701366,-65.40973,Museo Popular Municipal,Avenida  San Martín y Los Crespones,A4401XBA,0387,4901025,,,,,,"Expone el patrimonio cultural de la comunidad mostrando el producto de las dos vertientes que la nutrieron: bienes arqueológicos -ollas, urnas, platos, puntas de flecha y otras piezas- y bienes de valor histórico Post-Hispánico -cucharas de bronce, fotog",,,,
301042,66,66112040,Código en San José de Metan  (Est. Metan),MA-MUSEOS_AR-OSM-0849,Salta,Yatasto cerca de Metan,,,,,,,,-25.595939,-64.947686,Posta De Yatasto,Ruta 9 Km. 1446 A 6 Km de Metan,A4400XAM,0387,4215340,,,,Nacional,,"Ambientado como un típico casco de estancia, muestra elementos de la vida rural -mesa y arcón del siglo XVIII- hornacina con la imagen de San Antonio y una rústica cocina con todo sus enceres. También se exhiben elementos de la cultura del cuero, armas y",,,,
,,,,MA-MUSEOS_AR-OSM-1104,Salta,Salta,,,,node/2122906064,,,,-24.7458,-65.3983,Museo de la Casa de Castañares,,,,,,,,,,"En la casona se conserva una réplica del sable del general Güemes, en cuya empuñadura tiene grabada una imagen del campamento y de la Batalla de Salta",,,,
300056,70,70021010,Barreal  - Villa Pituil,MA-MUSEOS_AR-OSM-0851,San Juan,Barreal,,,,,,,,-31.632389,-69.46656,Museo Herrera,Calle Las Heras S/n,,,,,,,,,,,,,
300077,70,70021020,,MA-MUSEOS_AR-OSM-0852,San Juan,Calingasta,,,,,,,,-31.33751,-69.427453,Museo Arqueológico De Calingasta,Avenida  Argentina Entre Aldo Cantoni y Sarmiento,5403,02648,421043,,,,Provincial,,"Se podrán ver objetos arqueológicos encontrados en las hornillas y en la zona norte del departamento, localidad de Villa Corral. Elementos utilizados por pueblos originarios de la zona.",,,,
300102,70,70035020,,MA-MUSEOS_AR-OSM-0853,San Juan,Caucete,,,,,,,,-31.654169,-68.285278,Museo Histórico Regional Caucete,Juan José Bustos y Coronel Cabot,,0264,4961176,Amupri2@yahoo.com.ar,,,,,,,,,
300260,70,70056080,San José de Jachal San Juan,MA-MUSEOS_AR-OSM-0854,San Juan,Ciudad de Jachal,,,,,,,,-30.245769,-68.745496,Museo Arqueológico Prieto,Avda. 25 de Mayo 788 Oeste,J5460AAR,02647,420298,Amupri2@yahoo.com.ar,,,Privada,2001,"Cultura Ciénaga, Aguada, Angualasto de la zona de Iglesia y Jachal y otros sitios. Pequeña bodega, útiles agrícolas, máquinas de época.",2001,,,
300495,70,70049040,,MA-MUSEOS_AR-OSM-0855,San Juan,Las Flores,,,,,,,,-36.017328,-59.102572,Museo Histórico Alfredo Ramón Almada,General Paz 570,B7200BOS,02244,442387,direccioncultura@s2.coopenet.com.ar,,,Municipal,,"Armas utilizadas desde el Virreinato hasta la actualidad. Objetos de uso rural y gauchesco. Máquinas de escribir y de coser, telares, teodolitos, cámaras fotográficas y gramófonos.",,,,
300496,70,70049040,,MA-MUSEOS_AR-OSM-0856,San Juan,Las Flores,,,,,,,,-36.020201,-59.097906,Museo Ingeniero Carlos Echagüe,Alem y Sarmiento,B7200AIP,02244,452059,,,,Nacional,2007,Locomotora a vapor,2007,,,
300497,70,70049040,,MA-MUSEOS_AR-OSM-0857,San Juan,Las Flores,,,,,,,,-36.017328,-59.102572,Museo De Ciencias Naturales Florentino Ameghino,Avenida General Paz 570,B7200BOS,02244,452987,hgcrispiani@s2.coopenet.com.ar,,,Municipal,1971,Colecciones de paleontología regional del cuaternario; arqueología del país y del extranjero; mineralogía; zoología.,1971,,,
300602,70,70084010,Código en Rivadavia,MA-MUSEOS_AR-OSM-0858,San Juan,Parque Federico Cantoni,,,,,,,,-31.549594,-68.685819,Museo Geográfico Municipal Einstein,Túneles y Cavernas de La Quebrada del Zonda,5400,0264,4215343,,,,Provincial,1969,"Arqueología de los períodos Precerámicos y Agro-alfareros, antropología física, zoología, botánica y paleontología de San Juan. Las cavernas en las que se encuentra instalado el museo fueron excavadas por inmigrantes entre los años 1920 y 1932. La formac",1984,,,
300709,70,70084010,,MA-MUSEOS_AR-OSM-0859,San Juan,Rivadavia,,,,,,,,-31.5376,-68.5546,Museo Y Biblioteca Hnos. Nacif Weiss,Avenida  José Ignacio de La Roza 1516 (oeste),5400,0264,4292348,,,,Privada,1974,"Armas, fotografías, lámparas, abanicos, numismática, mobiliario, vestimenta, pinturas, etc. Material arqueológico, adornos y armas indígenas.",1980,,,
300800,70,70028010,,MA-MUSEOS_AR-OSM-0860,San Juan,San Juan,,,,,,,,-31.531819,-68.527069,Museo Don Julio,25 de Mayo 165 (oeste),J5400AHC,0264,4210492,,,,Privada,,"El museo resume la historia de Don Julio Marún, pionero sanjuanino de la olivicultura. En una de sus salas se ambienta San Juan antes del terremoto de 1944 y en otra se puede apreciar la elaboración del aceite.",,,,
300801,70,70028010,,MA-MUSEOS_AR-OSM-0861,San Juan,San Juan,,,,,,,,-31.53326,-68.51434,Museo Provincial De Bellas Artes Franklin Rawson,Av Libertador 862 (oeste),J5400ARV,0264,4200598,,,,Provincial,,"Valiosa colección de arte argentino de los siglos XIX, XX y XXI. Se exhiben obras de Berni, Victoríca, Gómez Cornet, Butler, Spilimbergo, Larrañaga, Rawson, Soldi, Guttero, Petorutti, Centurión, Forner, entre otros artistas consagrados; a lo que se suma",,,,
300802,70,70028010,,MA-MUSEOS_AR-OSM-0862,San Juan,San Juan,,,,,Museo Nacional,DNM,No,-31.5346,-68.529,Museo y Biblioteca Casa Natal de Sarmiento,Sarmiento Sur 21,J5402ECA,0264,4224603,info@casanatalsarmiento.gob.ar,https://casanatalsarmiento.cultura.gob.ar/,propios,Nacional,,"Desde su apertura al público en 1911, el Museo y Biblioteca Casa Natal de Sarmiento promueve el conocimiento del patrimonio tangible e intangible del gran prócer. A través de experiencias, talleres, exposiciones y el vínculo con otras instituciones, se desarrollan numerosas actividades culturales que impulsan el fortalecimiento de la figura del maestro, en un ámbito de aprendizaje y disfrute. ",,"Lu.-Vie. de 9:00 a 20:30 ha, Sáb., Dom. y feriados de 10:30 a 16 hs",,
300803,70,70028010,,MA-MUSEOS_AR-OSM-0863,San Juan,San Juan,,,,,,,,-31.538697,-68.535956,Museo Y Biblioteca De La Memoria Urbana,España y Mitre (ex Estación Ferroviaria San Martín),5400,0264,4218833,,,,Municipal,,"Centro de interpretación y biblioteca. Abarca desde la época prehispánica hasta nuestra actualidad. Maquetas, fotografías de ese San Juan de antaño anterior al terremoto de 1944, de la destrucción de la provincia de San Juan post terremoto de 1944 y foto",,,,
300804,70,70028010,,MA-MUSEOS_AR-OSM-0864,San Juan,San Juan,,,,,,,,-31.54129,-68.514664,Museo Histórico Provincial Agustín V. Gnecco,Avda. Rawson 621 (sur),J5402EVG,0264,4229638,,,,Provincial,,Bodega primitiva - interior  de la casa - taller y los quehaceres domésticos - el uso de la plata desde épocas coloniales - la casa colonial y la ciudad preterremoto - el trabajo del hombre de la región - la moda y las costumbres  en el San Juan del sigl,,,,
300805,70,70028010,,MA-MUSEOS_AR-OSM-0865,San Juan,San Juan,,,,,,,,-31.520405,-68.496563,Museo Santiago Graffigna,Colon 1342 (n),J5400GCD,0264,4214227,,,,Privada,,Está destinado a preservar el patrimonio de la familia Graffigna. El museo insta al visitante a apreciar el amor al trabajo de la tierra que los Graffigna demostraron a lo largo de más de un siglo. En el recorrido de sus ambientaciones se observa la impl,2007,,,
300806,70,70028010,,MA-MUSEOS_AR-OSM-0866,San Juan,San Juan,,,,,,,,-31.526181,-68.537961,Museo De Ciencias Naturales De San Juan,Avenida  España 400 (norte),J5400DNG,0264,4228557,,,,Nacional,1964,Cuenta con una de las colecciones más importantes de Paleovertebrados del Mesozoico inferior (triásico y jurásico) con una gran cantidad de especímenes completos y articulados. La misma posee aproximadamente 15 holotipos que incluyen los dinosaurios más,1964,,,
300965,70,70119050,,MA-MUSEOS_AR-OSM-0867,San Juan,Santa Lucia,,,,,,,,-30.566467,-67.540354,Museo Mineralógico Piedras Del Mundo,Ruta 510 S/n,J5449XAL,0264,156400200,,,,,,,,,,
300983,70,70077020,Villa Bolaños (Médano de Oro),MA-MUSEOS_AR-OSM-0868,San Juan,Usno,,,,,,,,-31.630542,-68.481669,Museo Parque Coleccion Suero,Médano de Oro,,0264,4251222,,,,,,,,,,
